{
  "schema_version": "0.1.0",
  "job_id": "job-1",
  "request_id": "request-1",
  "review_id": "review-1",
  "execution_id": "cloud-run-execution-1",
  "attempt_id": "attempt-1",
  "report_revision": 1,
  "mode": "review",
  "input": {
    "payload": {
      "artifact_id": "payload",
      "kind": "input",
      "uri": "gs://example-private-review/inputs/request-1.json",
      "generation": "1",
      "sha256": "a15c308399f3854ceca9d152e2c0198067850a2a12ccb1093ea1f30ef5cc4127",
      "content_type": "application/json"
    },
    "input_sha256": "a15c308399f3854ceca9d152e2c0198067850a2a12ccb1093ea1f30ef5cc4127"
  },
  "target": {
    "repository": "example-org/example-service",
    "pull_request_number": 42,
    "head_sha": "aaaaaaaaaaaaaaaaaaaaaaaaaaaaaaaaaaaaaaaa",
    "base_sha": "bbbbbbbbbbbbbbbbbbbbbbbbbbbbbbbbbbbbbbbb",
    "base_ref": "main",
    "merge_base_sha": "cccccccccccccccccccccccccccccccccccccccc"
  },
  "created_at": "2026-10-01T12:05:00Z",
  "review_status": "completed",
  "verdict": "requires_changes",
  "failure": null,
  "triage": {
    "schema_version": "0.1.0",
    "rationale": "Small API change requires security coverage and complete quality control. Two perspectives are useful.",
    "assignments": [
      {
        "model": {
          "model": "example-review-model",
          "effort": "high"
        },
        "owns_quality_control": false,
        "scope": "New endpoint and affected call path.",
        "instructions": "Inspect correctness and security. Do not rerun CI. Zero findings are allowed.",
        "rationale": "Externally supplied input affects a new endpoint.",
        "mandatory_lens_ids": [
          "security"
        ],
        "perspectives": [
          "correctness"
        ]
      },
      {
        "model": {
          "model": "example-review-model",
          "effort": "high"
        },
        "owns_quality_control": true,
        "scope": "Full quality checklist and new endpoint.",
        "instructions": "Assess Jira requirements and all mandatory quality checks. Zero findings are allowed.",
        "rationale": "Verify scope and handling of invalid identifiers.",
        "mandatory_lens_ids": [],
        "perspectives": [
          "quality_control",
          "correctness"
        ]
      }
    ]
  },
  "stages": [
    {
      "stage_id": "setup",
      "kind": "setup",
      "status": "succeeded",
      "attempt_count": 1,
      "started_at": "2026-10-01T12:00:00Z",
      "finished_at": "2026-10-01T12:00:30Z",
      "model": null,
      "output_artifact_ids": [],
      "failure": null,
      "usage": null,
      "completion_artifact": {
        "artifact_id": "setup-completion",
        "kind": "checkpoint",
        "uri": "gs://example-private-review/artifacts/setup-completion.json",
        "generation": "1",
        "sha256": "aaaaaaaaaaaaaaaaaaaaaaaaaaaaaaaaaaaaaaaaaaaaaaaaaaaaaaaaaaaaaaaa",
        "content_type": "application/json"
      },
      "reused_from": null
    },
    {
      "stage_id": "triage",
      "kind": "triage",
      "status": "succeeded",
      "attempt_count": 1,
      "started_at": "2026-10-01T12:00:30Z",
      "finished_at": "2026-10-01T12:01:00Z",
      "model": {
        "model": "example-review-model",
        "effort": "high"
      },
      "output_artifact_ids": [],
      "failure": null,
      "usage": null,
      "completion_artifact": {
        "artifact_id": "triage-completion",
        "kind": "checkpoint",
        "uri": "gs://example-private-review/artifacts/triage-completion.json",
        "generation": "1",
        "sha256": "aaaaaaaaaaaaaaaaaaaaaaaaaaaaaaaaaaaaaaaaaaaaaaaaaaaaaaaaaaaaaaaa",
        "content_type": "application/json"
      },
      "reused_from": null
    },
    {
      "stage_id": "r1",
      "kind": "reviewer",
      "status": "succeeded",
      "attempt_count": 1,
      "started_at": "2026-10-01T12:01:00Z",
      "finished_at": "2026-10-01T12:02:00Z",
      "model": {
        "model": "example-review-model",
        "effort": "high"
      },
      "output_artifact_ids": [],
      "failure": null,
      "usage": null,
      "completion_artifact": {
        "artifact_id": "r1-completion",
        "kind": "checkpoint",
        "uri": "gs://example-private-review/artifacts/r1-completion.json",
        "generation": "1",
        "sha256": "aaaaaaaaaaaaaaaaaaaaaaaaaaaaaaaaaaaaaaaaaaaaaaaaaaaaaaaaaaaaaaaa",
        "content_type": "application/json"
      },
      "reused_from": null
    },
    {
      "stage_id": "r2",
      "kind": "reviewer",
      "status": "succeeded",
      "attempt_count": 1,
      "started_at": "2026-10-01T12:01:00Z",
      "finished_at": "2026-10-01T12:02:00Z",
      "model": {
        "model": "example-review-model",
        "effort": "high"
      },
      "output_artifact_ids": [],
      "failure": null,
      "usage": null,
      "completion_artifact": {
        "artifact_id": "r2-completion",
        "kind": "checkpoint",
        "uri": "gs://example-private-review/artifacts/r2-completion.json",
        "generation": "1",
        "sha256": "aaaaaaaaaaaaaaaaaaaaaaaaaaaaaaaaaaaaaaaaaaaaaaaaaaaaaaaaaaaaaaaa",
        "content_type": "application/json"
      },
      "reused_from": null
    },
    {
      "stage_id": "dedupe",
      "kind": "deduplication",
      "status": "succeeded",
      "attempt_count": 1,
      "started_at": "2026-10-01T12:02:00Z",
      "finished_at": "2026-10-01T12:02:30Z",
      "model": {
        "model": "example-review-model",
        "effort": "high"
      },
      "output_artifact_ids": [],
      "failure": null,
      "usage": null,
      "completion_artifact": {
        "artifact_id": "dedupe-completion",
        "kind": "checkpoint",
        "uri": "gs://example-private-review/artifacts/dedupe-completion.json",
        "generation": "1",
        "sha256": "aaaaaaaaaaaaaaaaaaaaaaaaaaaaaaaaaaaaaaaaaaaaaaaaaaaaaaaaaaaaaaaa",
        "content_type": "application/json"
      },
      "reused_from": null
    },
    {
      "stage_id": "verify",
      "kind": "verification",
      "status": "succeeded",
      "attempt_count": 1,
      "started_at": "2026-10-01T12:02:30Z",
      "finished_at": "2026-10-01T12:03:30Z",
      "model": {
        "model": "example-review-model",
        "effort": "high"
      },
      "output_artifact_ids": [],
      "failure": null,
      "usage": null,
      "completion_artifact": {
        "artifact_id": "verify-completion",
        "kind": "checkpoint",
        "uri": "gs://example-private-review/artifacts/verify-completion.json",
        "generation": "1",
        "sha256": "aaaaaaaaaaaaaaaaaaaaaaaaaaaaaaaaaaaaaaaaaaaaaaaaaaaaaaaaaaaaaaaa",
        "content_type": "application/json"
      },
      "reused_from": null
    },
    {
      "stage_id": "compose",
      "kind": "composition",
      "status": "succeeded",
      "attempt_count": 1,
      "started_at": "2026-10-01T12:04:00Z",
      "finished_at": "2026-10-01T12:04:30Z",
      "model": null,
      "output_artifact_ids": [],
      "failure": null,
      "usage": null,
      "completion_artifact": {
        "artifact_id": "compose-completion",
        "kind": "checkpoint",
        "uri": "gs://example-private-review/artifacts/compose-completion.json",
        "generation": "1",
        "sha256": "aaaaaaaaaaaaaaaaaaaaaaaaaaaaaaaaaaaaaaaaaaaaaaaaaaaaaaaaaaaaaaaa",
        "content_type": "application/json"
      },
      "reused_from": null
    }
  ],
  "raw_findings": [
    {
      "source_finding_id": "raw-r1-1",
      "reviewer_id": "r1",
      "finding": {
        "candidate_id": "r1-c1",
        "title": "Invalid numeric identifiers return a server error.",
        "body": "An invalid identifier reaches int() without error handling. The resulting ValueError escapes the endpoint and returns HTTP 500 instead of the required HTTP 400.",
        "severity": "major",
        "category": "correctness",
        "relationship": "pr_related",
        "locations": [
          {
            "commit_sha": "aaaaaaaaaaaaaaaaaaaaaaaaaaaaaaaaaaaaaaaa",
            "path": "app/views.py",
            "start_line": 21,
            "end_line": 23,
            "side": "RIGHT"
          }
        ],
        "evidence": [
          {
            "kind": "code",
            "explanation": "The new endpoint converts untrusted text with int() without handling ValueError.",
            "source_ids": [
              "code-head"
            ],
            "location": {
              "commit_sha": "aaaaaaaaaaaaaaaaaaaaaaaaaaaaaaaaaaaaaaaa",
              "path": "app/views.py",
              "start_line": 21,
              "end_line": 23,
              "side": "RIGHT"
            }
          }
        ],
        "suggestion": null,
        "origin": "ai",
        "origin_source_ids": [],
        "primary_location": {
          "commit_sha": "aaaaaaaaaaaaaaaaaaaaaaaaaaaaaaaaaaaaaaaa",
          "path": "app/views.py",
          "start_line": 21,
          "end_line": 23,
          "side": "RIGHT"
        }
      }
    },
    {
      "source_finding_id": "raw-r2-1",
      "reviewer_id": "r2",
      "finding": {
        "candidate_id": "r2-c1",
        "title": "Invalid numeric identifiers return a server error.",
        "body": "An invalid identifier reaches int() without error handling. The resulting ValueError escapes the endpoint and returns HTTP 500 instead of the required HTTP 400.",
        "severity": "major",
        "category": "correctness",
        "relationship": "pr_related",
        "locations": [
          {
            "commit_sha": "aaaaaaaaaaaaaaaaaaaaaaaaaaaaaaaaaaaaaaaa",
            "path": "app/views.py",
            "start_line": 21,
            "end_line": 23,
            "side": "RIGHT"
          }
        ],
        "evidence": [
          {
            "kind": "code",
            "explanation": "The new endpoint converts untrusted text with int() without handling ValueError.",
            "source_ids": [
              "code-head"
            ],